{
  "dataset_year": 2026,
  "version": 1,
  "data_version": "2026.1",
  "last_updated": "2026-09-05",
  "description": "Curated public-identity-only featured Korean high school baseball prospect reference data for the player's first high school season. No gameplay ratings, projections, draft scores, private traits, or engine state.",
  "prospects": [
    {
      "id": "featured_hs_2026_001",
      "display_name": "하현승",
      "school_name": "부산고",
      "grade": 3,
      "position": "P",
      "raw_position": "투수",
      "throws": null,
      "bats": null,
      "height_cm": null,
      "weight_kg": null,
      "is_featured": true,
      "public_achievements": ["2026 제14회 아시아청소년야구선수권대회 대표팀 선발"],
      "notes": null,
      "sources": [{"type":"news_article","publisher":"연합뉴스","title":"아시아청소년야구선수권 대표팀 명단 발표…하현승·엄준상 승선","date":"2026-07-09","url":"https://www.yna.co.kr/view/AKR20260709099300007"}]
    },
    {
      "id": "featured_hs_2026_002",
      "display_name": "윤예성",
      "school_name": "인창고",
      "grade": 3,
      "position": "P",
      "raw_position": "투수",
      "throws": "R",
      "bats": "L",
      "height_cm": null,
      "weight_kg": null,
      "is_featured": true,
      "public_achievements": ["2026 제14회 아시아청소년야구선수권대회 대표팀 선발"],
      "notes": null,
      "sources": [
        {"type":"news_article","publisher":"연합뉴스","title":"아시아청소년야구선수권 대표팀 명단 발표…하현승·엄준상 승선","date":"2026-07-09","url":"https://www.yna.co.kr/view/AKR20260709099300007"},
        {"type":"public_player_profile","publisher":"18.44","title":"윤예성 선수 프로필","date":null,"url":"https://www.1844.kr/?device=mobile&p=player_detail&player=pl_eJfCp8Bi3eI-uUhzzM9S4g"}
      ]
    },
    {
      "id": "featured_hs_2026_003",
      "display_name": "박근서",
      "school_name": "서울디자인고",
      "grade": 3,
      "position": "P",
      "raw_position": "투수",
      "throws": null,
      "bats": null,
      "height_cm": null,
      "weight_kg": null,
      "is_featured": true,
      "public_achievements": ["2026 제14회 아시아청소년야구선수권대회 대표팀 선발"],
      "notes": null,
      "sources": [{"type":"news_article","publisher":"연합뉴스","title":"아시아청소년야구선수권 대표팀 명단 발표…하현승·엄준상 승선","date":"2026-07-09","url":"https://www.yna.co.kr/view/AKR20260709099300007"}]
    },
    {
      "id": "featured_hs_2026_004",
      "display_name": "한규민",
      "school_name": "대전고",
      "grade": 2,
      "position": "P",
      "raw_position": "투수",
      "throws": null,
      "bats": null,
      "height_cm": null,
      "weight_kg": null,
      "is_featured": true,
      "public_achievements": ["2026 제14회 아시아청소년야구선수권대회 대표팀 선발"],
      "notes": null,
      "sources": [{"type":"news_article","publisher":"연합뉴스","title":"아시아청소년야구선수권 대표팀 명단 발표…하현승·엄준상 승선","date":"2026-07-09","url":"https://www.yna.co.kr/view/AKR20260709099300007"}]
    },
    {
      "id": "featured_hs_2026_005",
      "display_name": "곽도현",
      "school_name": "부산공업고",
      "grade": 3,
      "position": "P",
      "raw_position": "투수",
      "throws": "R",
      "bats": null,
      "height_cm": null,
      "weight_kg": null,
      "is_featured": true,
      "public_achievements": ["2026 제14회 아시아청소년야구선수권대회 대표팀 선발"],
      "notes": null,
      "sources": [{"type":"news_article","publisher":"연합뉴스","title":"아시아청소년야구선수권 대표팀 명단 발표…하현승·엄준상 승선","date":"2026-07-09","url":"https://www.yna.co.kr/view/AKR20260709099300007"}]
    },
    {
      "id": "featured_hs_2026_006",
      "display_name": "김민훈",
      "school_name": "광주진흥고",
      "grade": 3,
      "position": "P",
      "raw_position": "투수",
      "throws": null,
      "bats": null,
      "height_cm": null,
      "weight_kg": null,
      "is_featured": true,
      "public_achievements": ["2026 제14회 아시아청소년야구선수권대회 대표팀 선발"],
      "notes": null,
      "sources": [{"type":"news_article","publisher":"연합뉴스","title":"아시아청소년야구선수권 대표팀 명단 발표…하현승·엄준상 승선","date":"2026-07-09","url":"https://www.yna.co.kr/view/AKR20260709099300007"}]
    },
    {
      "id": "featured_hs_2026_007",
      "display_name": "엄준상",
      "school_name": "덕수고",
      "grade": 3,
      "position": "IF",
      "raw_position": "내야수",
      "throws": null,
      "bats": null,
      "height_cm": null,
      "weight_kg": null,
      "is_featured": true,
      "public_achievements": ["2026 제14회 아시아청소년야구선수권대회 대표팀 선발"],
      "notes": null,
      "sources": [{"type":"news_article","publisher":"연합뉴스","title":"아시아청소년야구선수권 대표팀 명단 발표…하현승·엄준상 승선","date":"2026-07-09","url":"https://www.yna.co.kr/view/AKR20260709099300007"}]
    },
    {
      "id": "featured_hs_2026_008",
      "display_name": "우주로",
      "school_name": "대전고",
      "grade": 3,
      "position": "IF",
      "raw_position": "내야수",
      "throws": null,
      "bats": null,
      "height_cm": null,
      "weight_kg": null,
      "is_featured": true,
      "public_achievements": ["2026 제14회 아시아청소년야구선수권대회 대표팀 선발"],
      "notes": null,
      "sources": [{"type":"news_article","publisher":"연합뉴스","title":"아시아청소년야구선수권 대표팀 명단 발표…하현승·엄준상 승선","date":"2026-07-09","url":"https://www.yna.co.kr/view/AKR20260709099300007"}]
    },
    {
      "id": "featured_hs_2026_009",
      "display_name": "남현우",
      "school_name": "서울컨벤션고",
      "grade": 3,
      "position": "IF",
      "raw_position": "내야수",
      "throws": null,
      "bats": null,
      "height_cm": null,
      "weight_kg": null,
      "is_featured": true,
      "public_achievements": ["2026 제14회 아시아청소년야구선수권대회 대표팀 선발"],
      "notes": null,
      "sources": [{"type":"news_article","publisher":"연합뉴스","title":"아시아청소년야구선수권 대표팀 명단 발표…하현승·엄준상 승선","date":"2026-07-09","url":"https://www.yna.co.kr/view/AKR20260709099300007"}]
    },
    {
      "id": "featured_hs_2026_010",
      "display_name": "김지우",
      "school_name": "서울고",
      "grade": 3,
      "position": "IF",
      "raw_position": "내야수",
      "throws": "R",
      "bats": "R",
      "height_cm": null,
      "weight_kg": null,
      "is_featured": true,
      "public_achievements": ["2026 제14회 아시아청소년야구선수권대회 대표팀 선발"],
      "notes": null,
      "sources": [
        {"type":"news_article","publisher":"연합뉴스","title":"아시아청소년야구선수권 대표팀 명단 발표…하현승·엄준상 승선","date":"2026-07-09","url":"https://www.yna.co.kr/view/AKR20260709099300007"},
        {"type":"public_player_profile","publisher":"18.44","title":"김지우 선수 프로필","date":null,"url":"https://www.1844.kr/?device=mobile&p=player_detail&player=pl_GC2Q8sHV1edL3LVTuHPOBA"}
      ]
    },
    {
      "id": "featured_hs_2026_011",
      "display_name": "강인규",
      "school_name": "청주고",
      "grade": 3,
      "position": "IF",
      "raw_position": "내야수",
      "throws": null,
      "bats": null,
      "height_cm": null,
      "weight_kg": null,
      "is_featured": true,
      "public_achievements": ["2026 제14회 아시아청소년야구선수권대회 대표팀 선발"],
      "notes": null,
      "sources": [{"type":"news_article","publisher":"연합뉴스","title":"아시아청소년야구선수권 대표팀 명단 발표…하현승·엄준상 승선","date":"2026-07-09","url":"https://www.yna.co.kr/view/AKR20260709099300007"}]
    },
    {
      "id": "featured_hs_2026_012",
      "display_name": "이호민",
      "school_name": "경남고",
      "grade": 3,
      "position": "IF",
      "raw_position": "내야수",
      "throws": null,
      "bats": null,
      "height_cm": null,
      "weight_kg": null,
      "is_featured": true,
      "public_achievements": ["2026 제14회 아시아청소년야구선수권대회 대표팀 선발"],
      "notes": null,
      "sources": [{"type":"news_article","publisher":"연합뉴스","title":"아시아청소년야구선수권 대표팀 명단 발표…하현승·엄준상 승선","date":"2026-07-09","url":"https://www.yna.co.kr/view/AKR20260709099300007"}]
    },
    {
      "id": "featured_hs_2026_013",
      "display_name": "장민제",
      "school_name": "충암고",
      "grade": 3,
      "position": "OF",
      "raw_position": "외야수",
      "throws": null,
      "bats": null,
      "height_cm": null,
      "weight_kg": null,
      "is_featured": true,
      "public_achievements": ["2026 제14회 아시아청소년야구선수권대회 대표팀 선발"],
      "notes": null,
      "sources": [{"type":"news_article","publisher":"연합뉴스","title":"아시아청소년야구선수권 대표팀 명단 발표…하현승·엄준상 승선","date":"2026-07-09","url":"https://www.yna.co.kr/view/AKR20260709099300007"}]
    },
    {
      "id": "featured_hs_2026_014",
      "display_name": "조희성",
      "school_name": "유신고",
      "grade": 3,
      "position": "OF",
      "raw_position": "외야수",
      "throws": null,
      "bats": null,
      "height_cm": null,
      "weight_kg": null,
      "is_featured": true,
      "public_achievements": ["2026 제14회 아시아청소년야구선수권대회 대표팀 선발"],
      "notes": null,
      "sources": [{"type":"news_article","publisher":"연합뉴스","title":"아시아청소년야구선수권 대표팀 명단 발표…하현승·엄준상 승선","date":"2026-07-09","url":"https://www.yna.co.kr/view/AKR20260709099300007"}]
    },
    {
      "id": "featured_hs_2026_015",
      "display_name": "황성현",
      "school_name": "덕수고",
      "grade": 3,
      "position": "OF",
      "raw_position": "외야수",
      "throws": null,
      "bats": null,
      "height_cm": null,
      "weight_kg": null,
      "is_featured": true,
      "public_achievements": ["2026 제14회 아시아청소년야구선수권대회 대표팀 선발"],
      "notes": null,
      "sources": [{"type":"news_article","publisher":"연합뉴스","title":"아시아청소년야구선수권 대표팀 명단 발표…하현승·엄준상 승선","date":"2026-07-09","url":"https://www.yna.co.kr/view/AKR20260709099300007"}]
    },
    {
      "id": "featured_hs_2026_016",
      "display_name": "박보승",
      "school_name": "경남고",
      "grade": 3,
      "position": "OF",
      "raw_position": "외야수",
      "throws": null,
      "bats": null,
      "height_cm": null,
      "weight_kg": null,
      "is_featured": true,
      "public_achievements": ["2026 제14회 아시아청소년야구선수권대회 대표팀 선발"],
      "notes": null,
      "sources": [{"type":"news_article","publisher":"연합뉴스","title":"아시아청소년야구선수권 대표팀 명단 발표…하현승·엄준상 승선","date":"2026-07-09","url":"https://www.yna.co.kr/view/AKR20260709099300007"}]
    },
    {
      "id": "featured_hs_2026_017",
      "display_name": "원지우",
      "school_name": "강릉고",
      "grade": 3,
      "position": "C",
      "raw_position": "포수",
      "throws": null,
      "bats": null,
      "height_cm": null,